{
  "schema": "crawl_record.v1",
  "vertical": "devdocs",
  "url": "http://fixture.loom.test/js/array-filter.html?utm_source=x",
  "canonical_url": "http://fixture.loom.test/js/array-filter.html",
  "fetched_at": "2026-07-13T10:00:05Z",
  "status_code": 200,
  "content_type": "text/html",
  "depth": 2,
  "html": "<html><head><title>Array.prototype.filter()</title></head><body><p>Creates a shallow copy filtered down.</p><a href=\"/js/array-map.html\">map</a></body></html>",
  "links": [
    "http://fixture.loom.test/js/array-map.html"
  ],
  "simhash64": "9f8e7d6c5b4a3210",
  "etag": "\"abc123\"",
  "last_modified": "Sun, 12 Jul 2026 08:30:00 GMT"
}
